sessionId,askAnswerId,machineId,configId,rating,startAt,reason,reasonText,machineName,firstQuestion,firstAnswer,language
1764421117158,RATING,135ef541-0de0-41cb-bd1f-c909b3ddb9a3,c9cc2d27f5c76ffd8e18ecfe24419215,4,2025-11-29T20:34:20.292641+07:00,,,TheMall-001-M8-BKP-01,quick reply: MCard,MCard comes in various types. You can click the cards below to explore them.,en-US
1764410986866,RATING,135ef541-0de0-41cb-bd1f-c909b3ddb9a3,c9cc2d27f5c76ffd8e18ecfe24419215,1,2025-11-29T17:09:52.209708+07:00,,,TheMall-001-M8-BKP-01,ถ้าจะไปโลตัสต้องไปทางไหนครับ,"โลตัสอยู่ที่ The Mall Lifestore บางกะปิค่ะ
ร้านอยู่ที่ชั้น 2 ของห้างนะคะ
คุณสามารถขึ้นบันไดเลื่อนหรือใช้ลิฟต์ไปชั้น 2 ได้เลยค่ะ
โลตัสมีสินค้าหมวดเครื่องนอนและที่นอนคุณภาพดีมากค่ะ
ถ้าคุณต้องการข้อมูลเพิ่มเติม แจ้งได้นะคะ",th-TH
1764308377569,RATING,135ef541-0de0-41cb-bd1f-c909b3ddb9a3,c9cc2d27f5c76ffd8e18ecfe24419215,4,2025-11-28T12:39:39.88147+07:00,helpfulness,Helpfulness,TheMall-001-M8-BKP-01,quick reply: promotion,"ตอนนี้มีโปรโมชั่นดี ๆ หลายรายการเลยค่ะ
ลูกค้าสามารถแตะดูรายละเอียดจากการ์ดด้านล่างได้เลยนะคะ",th-TH
1764072251769,RATING,135ef541-0de0-41cb-bd1f-c909b3ddb9a3,c9cc2d27f5c76ffd8e18ecfe24419215,4,2025-11-25T19:13:29.45935+07:00,helpfulness,Helpfulness,TheMall-001-M8-BKP-01,quick reply: Directory,"You’re now at The Mall Life Store Bangkapi.
Is there any store or brand you’d like to find? I can help you with that!",en-US
1764042071807,RATING,135ef541-0de0-41cb-bd1f-c909b3ddb9a3,c9cc2d27f5c76ffd8e18ecfe24419215,1,2025-11-25T11:31:43.27792+07:00,helpfulness,Helpfulness,TheMall-001-M8-BKP-01,quick reply: Directory,"You’re now at The Mall Life Store Bangkapi.
Is there any store or brand you’d like to find? I can help you with that!",en-US
1763987297351,RATING,135ef541-0de0-41cb-bd1f-c909b3ddb9a3,c9cc2d27f5c76ffd8e18ecfe24419215,4,2025-11-24T19:28:22.378346+07:00,helpfulness,Helpfulness,TheMall-001-M8-BKP-01,สวัสดีครับ,"ฉันคือ M-Agent ค่ะ
ยินดีที่ได้ช่วยเหลือคุณ",th-TH
1763869427184,RATING,135ef541-0de0-41cb-bd1f-c909b3ddb9a3,c9cc2d27f5c76ffd8e18ecfe24419215,2,2025-11-23T10:43:54.824033+07:00,,,TheMall-001-M8-BKP-01,Where is the phone service?,"You can find phone services on the 2nd floor of The Mall Lifestore Bangkapi.
For example, Vivo offers mobile phones there.
Also, TRUE l DTAC provides mobile phones, accessories, and tech services.
AIS PARTNER offers IT and electronics services including customer service.
Samsung Service by Jaymart provides electronics services and device repair.",en-US
1763810530393,RATING,135ef541-0de0-41cb-bd1f-c909b3ddb9a3,c9cc2d27f5c76ffd8e18ecfe24419215,3,2025-11-22T18:22:15.417125+07:00,,,TheMall-001-M8-BKP-01,สวัสดี,"สวัสดีค่ะ
มีอะไรให้ช่วยไหมคะ?",th-TH
1763808780174,RATING,135ef541-0de0-41cb-bd1f-c909b3ddb9a3,c9cc2d27f5c76ffd8e18ecfe24419215,4,2025-11-22T17:53:02.630349+07:00,speed,Speed,TheMall-001-M8-BKP-01,quick reply: MCard,MCard มีหลากหลายรูปแบบ สามารถคลิกดูได้ตาม Card ด้านล่าง,th-TH
1763807913201,RATING,135ef541-0de0-41cb-bd1f-c909b3ddb9a3,c9cc2d27f5c76ffd8e18ecfe24419215,4,2025-11-22T17:38:34.207371+07:00,,,TheMall-001-M8-BKP-01,quick reply: Directory,"You’re now at The Mall Life Store Bangkapi.
Is there any store or brand you’d like to find? I can help you with that!",en-US
1763796998897,RATING,135ef541-0de0-41cb-bd1f-c909b3ddb9a3,c9cc2d27f5c76ffd8e18ecfe24419215,3,2025-11-22T14:36:45.561551+07:00,helpfulness,Helpfulness,TheMall-001-M8-BKP-01,Where are the cigarettes?,"I'm sorry, I couldn't find information about where the cigarettes are located.
If I misunderstood your question, please ask again.",en-US
1763619152261,RATING,135ef541-0de0-41cb-bd1f-c909b3ddb9a3,c9cc2d27f5c76ffd8e18ecfe24419215,4,2025-11-20T13:12:37.306149+07:00,,,TheMall-001-M8-BKP-01,น้าเบนซ์,"ขออภัยค่ะ ฉันไม่พบข้อมูลเกี่ยวกับ น้าเบนซ์
ถ้าฉันเข้าใจคำถามของคุณผิดพลาด กรุณาถามอีกครั้งค่ะ",th-TH
1763526946748,RATING,135ef541-0de0-41cb-bd1f-c909b3ddb9a3,c9cc2d27f5c76ffd8e18ecfe24419215,3,2025-11-19T11:35:53.775946+07:00,,,TheMall-001-M8-BKP-01,luggage,"You can find luggage at several stores on the 1st floor of The Mall Lifestore Bangkapi.
Here are some options for you:
AMERICANTOURISTER offers a wide range of luggage, bags, backpacks, carry-ons, and suitcases.
Caterpillar sells luggage, bags, and backpacks.",en-US
1763288557597,RATING,135ef541-0de0-41cb-bd1f-c909b3ddb9a3,c9cc2d27f5c76ffd8e18ecfe24419215,1,2025-11-16T17:22:38.491604+07:00,accuracy,Accuracy,TheMall-001-M8-BKP-01,quick reply: Directory,You’re now at The Mall Life Store Bangkapi.,en-US
1763213629991,RATING,135ef541-0de0-41cb-bd1f-c909b3ddb9a3,c9cc2d27f5c76ffd8e18ecfe24419215,4,2025-11-15T20:33:55.738147+07:00,helpfulness,Helpfulness,TheMall-001-M8-BKP-01,UNIQLO อยู่ชั้นไหน,"UNIQLO อยู่ที่ชั้น M ค่ะ
ถ้าคุณต้องการไปช้อปปิ้งเสื้อผ้าหรือเครื่องประดับที่นี่ ชั้น M คือที่ตั้งของร้านค่ะ
มีอะไรให้ช่วยอีกไหมคะ?",th-TH
1763199996518,RATING,135ef541-0de0-41cb-bd1f-c909b3ddb9a3,c9cc2d27f5c76ffd8e18ecfe24419215,4,2025-11-15T16:46:38.577419+07:00,helpfulness,Helpfulness,TheMall-001-M8-BKP-01,quick reply: promotion,"ตอนนี้มีโปรโมชั่นดี ๆ หลายรายการเลยค่ะ
ลูกค้าสามารถแตะดูรายละเอียดจากการ์ดด้านล่างได้เลยนะคะ",th-TH
1763187713332,RATING,135ef541-0de0-41cb-bd1f-c909b3ddb9a3,c9cc2d27f5c76ffd8e18ecfe24419215,3,2025-11-15T13:21:55.619987+07:00,,,TheMall-001-M8-BKP-01,quick reply: Directory,"ขณะนี้ลูกค้าอยู่ที่เดอะมอลล์ไลฟ์สโตร์ บางกะปิ นะคะ
อยากหาร้านไหนหรือแบรนด์อะไรเป็นพิเศษไหมคะ เดี๋ยวฉันช่วยดูให้ค่ะ",th-TH
1763032876828,RATING,135ef541-0de0-41cb-bd1f-c909b3ddb9a3,c9cc2d27f5c76ffd8e18ecfe24419215,4,2025-11-13T18:21:17.681607+07:00,helpfulness,Helpfulness,TheMall-001-M8-BKP-01,quick reply: Directory,"You’re now at The Mall Life Store Bangkapi.
Is there any store or brand you’d like to find? I can help you with that!",en-US
1762953239775,RATING,135ef541-0de0-41cb-bd1f-c909b3ddb9a3,c9cc2d27f5c76ffd8e18ecfe24419215,4,2025-11-12T20:14:06.348652+07:00,,,TheMall-001-M8-BKP-01,ร้าน Jaymart,"ร้าน Jaymart อยู่ที่ The Mall Lifestore Bangkapi ค่ะ
อยู่ที่ชั้น 2
มีสินค้าอิเล็กทรอนิกส์ โทรศัพท์มือถือ อุปกรณ์เสริม และแก็ดเจ็ตหลากหลาย",th-TH
1762944208745,RATING,135ef541-0de0-41cb-bd1f-c909b3ddb9a3,c9cc2d27f5c76ffd8e18ecfe24419215,2,2025-11-12T17:43:33.797743+07:00,speed,Speed,TheMall-001-M8-BKP-01,กระเป๋า,"ที่ The Mall Bangkapi มีร้านขายกระเป๋าหลายร้านค่ะ
เช่น AMERICANTOURISTER มีทั้งกระเป๋าเดินทาง กระเป๋าสะพายหลัง กระเป๋าถือ และกระเป๋าแบบต่างๆ
ร้าน Caterpillar ก็มีทั้งกระเป๋าเป้และกระเป๋าเดินทาง
SAMSONITE และ SAMSONITE RED ก็มีจำหน่ายกระเป๋าเดินทางและกระเป๋าสะพายหลัง
ส่วน GREGORY เน้นกระเป๋าเป้สำหรับเดินทางและกิจกรรมกลางแจ้งที่ทนทานและใส่สบาย
ร้านทั้งหมดอยู่ที่ชั้น 1 ค่ะ
คุณสนใจร้านไหนเป็นพิเศษไหมคะ?",th-TH
1762939995391,RATING,135ef541-0de0-41cb-bd1f-c909b3ddb9a3,c9cc2d27f5c76ffd8e18ecfe24419215,4,2025-11-12T16:33:22.063584+07:00,,,TheMall-001-M8-BKP-01,ทางไป MRT,"ขออภัยค่ะ ฉันไม่พบข้อมูลเกี่ยวกับทางไป MRT
ถ้าฉันเข้าใจคำถามของคุณผิดพลาด กรุณาถามอีกครั้งค่ะ",th-TH
1762762818707,RATING,135ef541-0de0-41cb-bd1f-c909b3ddb9a3,c9cc2d27f5c76ffd8e18ecfe24419215,2,2025-11-10T15:20:21.585372+07:00,accuracy,Accuracy,TheMall-001-M8-BKP-01,quick reply: Directory,You’re now at The Mall Life Store Bangkapi.,en-US
1762761159609,RATING,135ef541-0de0-41cb-bd1f-c909b3ddb9a3,c9cc2d27f5c76ffd8e18ecfe24419215,3,2025-11-10T14:52:53.275539+07:00,helpfulness,Helpfulness,TheMall-001-M8-BKP-01,quick reply: Directory,"You’re now at The Mall Life Store Bangkapi.
Is there any store or brand you’d like to find? I can help you with that!",en-US
1762684611220,RATING,135ef541-0de0-41cb-bd1f-c909b3ddb9a3,c9cc2d27f5c76ffd8e18ecfe24419215,4,2025-11-09T18:23:49.256607+07:00,,,TheMall-001-M8-BKP-01,quick reply: Directory,"You’re now at The Mall Life Store Bangkapi.
Is there any store or brand you’d like to find? I can help you with that!",en-US
1762597770532,RATING,135ef541-0de0-41cb-bd1f-c909b3ddb9a3,c9cc2d27f5c76ffd8e18ecfe24419215,3,2025-11-08T17:29:35.896832+07:00,,,TheMall-001-M8-BKP-01,ร้านอาหารอยู่ไหน,"ร้านอาหารใน The Mall Lifestore Bangkapi อยู่ที่ชั้น1 และชั้น3 ค่ะ
เช่น ร้าน INTHANIN อยู่ที่ชั้น1
ส่วนร้าน KOFUKU, Liyang, DOU และ Liunitea อยู่ที่ชั้น3 ค่ะ",th-TH
1762583004304,RATING,135ef541-0de0-41cb-bd1f-c909b3ddb9a3,c9cc2d27f5c76ffd8e18ecfe24419215,2,2025-11-08T13:23:31.774597+07:00,,,TheMall-001-M8-BKP-01,Where is the toilet?,"Toilets are available on every floor of The Mall Bangkapi.
Disabled restrooms are located near the general restrooms on each floor.
So you can find toilets easily wherever you are in the mall.
If you need more specific directions, just ask!",en-US
1762522393837,RATING,135ef541-0de0-41cb-bd1f-c909b3ddb9a3,c9cc2d27f5c76ffd8e18ecfe24419215,2,2025-11-07T20:33:23.87301+07:00,,,TheMall-001-M8-BKP-01,วันที่ 9 พฤศจิกายน ที่เดอะมอลล์บางกะปิ มีงานจัด Event มีงานอะไรบ้างที่ MCC Hall,"ขออภัยค่ะ ฉันไม่พบข้อมูลเกี่ยวกับงานอีเวนต์วันที่9 พฤศจิกายน ที่ MCC Hall เดอะมอลล์บางกะปิ
ถ้าฉันเข้าใจคำถามของคุณผิดพลาด กรุณาถามอีกครั้งค่ะ",th-TH
1762521078089,RATING,135ef541-0de0-41cb-bd1f-c909b3ddb9a3,c9cc2d27f5c76ffd8e18ecfe24419215,1,2025-11-07T20:11:35.543264+07:00,helpfulness,Helpfulness,TheMall-001-M8-BKP-01,Hello สวัสดี,"ฉันคือ M-Agent ค่ะ
ยินดีที่ได้ช่วยเหลือคุณ
มีอะไรให้ช่วยไหมคะ?",th-TH
1762517324601,RATING,135ef541-0de0-41cb-bd1f-c909b3ddb9a3,c9cc2d27f5c76ffd8e18ecfe24419215,3,2025-11-07T19:08:52.169712+07:00,accuracy,Accuracy,TheMall-001-M8-BKP-01,the Puma shop,"Puma is located at The Mall Lifestore Bangkapi.
You can find it on the1st floor.
The store offers sportswear, activewear, sneakers, and athleisure fashion.
It's a great place if you're looking for sporty and casual styles.
Let me know if you want to know more!",en-US
1762258484253,RATING,135ef541-0de0-41cb-bd1f-c909b3ddb9a3,c9cc2d27f5c76ffd8e18ecfe24419215,3,2025-11-04T19:14:45.521359+07:00,,,TheMall-001-M8-BKP-01,quick reply: Directory,You’re now at The Mall Life Store Bangkapi.,en-US
1762090897412,RATING,135ef541-0de0-41cb-bd1f-c909b3ddb9a3,c9cc2d27f5c76ffd8e18ecfe24419215,4,2025-11-02T20:41:44.26485+07:00,helpfulness,Helpfulness,TheMall-001-M8-BKP-01,ตะวันนาอยู่ไหน,"ขออภัยค่ะ ฉันไม่พบข้อมูลเกี่ยวกับ ตะวันนา
ถ้าฉันเข้าใจคำถามของคุณผิดพลาด กรุณาถามอีกครั้งค่ะ",th-TH